ato,dodf,treated_text,PROCESSO,ORGAO_LICITANTE,NUM_LICITACAO,MODALIDADE_LICITACAO,NOME_RESPONSAVEL,DATA_ESCRITO,IDENTIFICACAO_OCORRENCIA,IOB
AVISO_ANUL_REV_LICITACAO,637,"AVISO DE ANULAÇÃO DA LICITAÇÃO CONCORRÊNCIA Nº 01/20121 A Companhia de Desenvolvimento Habitacional do Distrito Federal CODHAB/DF, no uso de suas atribuições, torna público o Aviso de anulação da Concorrência 01/2021 PROCESSO PROCESSO SEI Nº 00392-00014723/2020-27, que tem por objeto a promoção de empreendimentos habitacionais por meio da produção e comercialização de Unidades Habitacionais a serem disponibilizadas ao cadastro de habitação, em terrenos de propriedade da CODHAB localizadas em Santa Maria RA XIII, em atendimento à política habitacional do Governo do Distrito Federal, de acordo com as especificações e quantitativos contidos no Projeto Básico constante do Anexo I do Edital, conforme após a aprovação da Súmula SEI-GDF CODHAB/PRESI/DIPRO n.º 26/2021 (67797043), pela Diretoria Executiva da CODHAB, em 23 de agosto de 2021 e solicitação da área demandante no Despacho CODHAB/PRESI/DIPRO/GEPHAB (72810303). Brasília/DF, 26 de outubro de 2021. FERNANDA VITORINO Presidente da Comissão",00392-00014723/2020-27,Companhia de Desenvolvimento Habitacional do Distrito Federal CODHAB/DF,01/2021,Concorrência,FERNANDA VITORINO,26 de outubro de 2021,anulação,O O O O O O O O O B-ORGAO_LICITANTE I-ORGAO_LICITANTE I-ORGAO_LICITANTE I-ORGAO_LICITANTE I-ORGAO_LICITANTE I-ORGAO_LICITANTE I-ORGAO_LICITANTE I-ORGAO_LICITANTE O O O O O O O O O O O O B-IDENTIFICACAO_OCORRENCIA O B-MODALIDADE_LICITACAO O O O O O B-PROCESSO O O O O O O O O O O O O O O O O O O O O O O O O O O O O O O O O O O O O O O O O O O O O O O O O O O O O O O O O O O O O O O O O O O O O O O O O O O O O O O O O O O O O O O O O O O O O O O O O O O O O O O O O O O O O O B-DATA_ESCRITO I-DATA_ESCRITO I-DATA_ESCRITO I-DATA_ESCRITO I-DATA_ESCRITO O B-NOME_RESPONSAVEL I-NOME_RESPONSAVEL O O O
AVISO_ANUL_REV_LICITACAO,637,"AVISO DE REVOGAÇÃO PREGÃO ELETRÔNICO Nº 56/2021 A presente licitação tem por objeto a aquisição de material permanente aquisição aquisição de equipamentos para aparelhamento/substituição/melhoramento do Laboratório de Solos (NULSO) do Departamento de Estradas de Rodagem do Distrito Federal (DER/DF), tudo conforme especificado no Edital e em seus anexos. Processo 00113-00005906/2021-95. Fica revogada, fundamentação nos autos do processo. Brasília/DF, 29 de julho de 2021 ANA HILDA DO CARMO SILVA Diretora",00113-00005906/2021-95,Departamento de Estradas de Rodagem do Distrito Federal (DER/DF),56/2021,PREGÃO ELETRÔNICO,ANA HILDA DO CARMO SILVA,29 de julho de 2021,revogada,O O O B-MODALIDADE_LICITACAO I-MODALIDADE_LICITACAO O B-NUM_LICITACAO O O O O O O O O O O O O O O O O O O O O O O O O O B-ORGAO_LICITANTE I-ORGAO_LICITANTE I-ORGAO_LICITANTE I-ORGAO_LICITANTE I-ORGAO_LICITANTE I-ORGAO_LICITANTE I-ORGAO_LICITANTE I-ORGAO_LICITANTE I-ORGAO_LICITANTE I-ORGAO_LICITANTE I-ORGAO_LICITANTE O O O O O O O O O O O O B-PROCESSO O O B-IDENTIFICACAO_OCORRENCIA O O O O O O O O O B-DATA_ESCRITO I-DATA_ESCRITO I-DATA_ESCRITO I-DATA_ESCRITO I-DATA_ESCRITO B-NOME_RESPONSAVEL I-NOME_RESPONSAVEL I-NOME_RESPONSAVEL I-NOME_RESPONSAVEL I-NOME_RESPONSAVEL O
AVISO_ANUL_REV_LICITACAO,629,"AVISO DE ANULAÇÃO DE LICITAÇÃO PREGÃO ELETRÔNICO Nº 32/2021 Processo: 00050-00037099/2020-71. TIPO: Menor Preço. MODO DE DISPUTA: Aberto. OBJETO: Registro de Preço para futura aquisição de equipamentos de Tecnologia da Informação e Comunicação (TIC) objetivando a aquisição de Solução de Firewalls, envolvendo a prestação dos serviços de instalação, configuração, suporte técnico, manutenção e treinamento composto de operação assistida e tutela técnica para sustentação de serviços de Segurança Pública do DF. A SSP informa aos interessados no presente Certame a ANULAÇÃO do Pregão Eletrônico nº 32/2021-SSPDF, com fulcro nos termos do art. 4º, III, da Lei federal nº 10.520/2002 e art. 14, III, do Decreto federal nº 10.024/2019, bem como violação dos princípios da legalidade, do julgamento objetivo, da isonomia, da publicidade e da competitividade, estabelecidos pelo art. 37 da Constituição Federal, pelo art. 19 da Lei Orgânica do DF, e no art. 2º, do Decreto Federal nº 10.024/2019. Brasília/DF, 05 de janeiro de 2022 CELSO WAGNER LIMA Subsecretário",00050-00037099/2020-71,SSP,32/2021-SSPDF,Pregão Eletrônico,CELSO WAGNER LIMA,05 de janeiro de 2022,ANULAÇÃO,O O B-IDENTIFICACAO_OCORRENCIA O O O O O O O O B-PROCESSO O O O O O O O O O O O O O O O O O O O O O O O O O O O O O O O O O O O O O O O O O O O O O O O O O O O O O O O O O O O O O O O O O O O O O O O O O B-ORGAO_LICITANTE O O O O O O O B-IDENTIFICACAO_OCORRENCIA O B-MODALIDADE_LICITACAO I-MODALIDADE_LICITACAO O B-NUM_LICITACAO O O O O O O O O O O O O O O O O O O O O O O O O O O O O O O O O O O O O O O O O O O O O O O O O O O O O O O O O O O O O O O O O O O O O O O O O O O O O O O O O O O O O B-DATA_ESCRITO I-DATA_ESCRITO I-DATA_ESCRITO I-DATA_ESCRITO I-DATA_ESCRITO B-NOME_RESPONSAVEL I-NOME_RESPONSAVEL I-NOME_RESPONSAVEL O
AVISO_ANUL_REV_LICITACAO,629,"AVISO DE REVOGAÇÃO DE PREGÃO ELETRÔNICO Nº 04/2021 Processo: 00074-00000002/2020-97. OBJETO: Venda de madeira em pé da espécie Pinus sp, com corte e retirada do insumo no local, conforme especificações, condições e exigências estabelecidas no Edital nº 04/2021 e seus anexos. Em razão da impossibilidade de prosseguimento do certame em decorrência da falha de sistema relatada na Nota Técnica CAIXA NT_0004_2021_CEPEM NT_0004_2021_CEPEM 08_12_2021 (75803745), REVOGA-SE o Pregão Eletrônico nº 04/2021, a que se refere o Edital de Licitação 04/2021 (67386008). SALVADOR CARDOSO Pregoeiro",00074-00000002/2020-97,,04/2021,Pregão Eletrônico,SALVADOR CARDOSO,,REVOGA-SE,O O O O O O O B-NUM_LICITACAO O O B-PROCESSO O O O O O O O O O O O O O O O O O O O O O O O O O O O O O O O O B-NUM_LICITACAO O O O O O O O O O O O O O O O O O O O O O O O O O O O O O O B-IDENTIFICACAO_OCORRENCIA O B-MODALIDADE_LICITACAO I-MODALIDADE_LICITACAO O B-NUM_LICITACAO O O O O O O O O O B-NUM_LICITACAO O O O O B-NOME_RESPONSAVEL I-NOME_RESPONSAVEL O
AVISO_ANUL_REV_LICITACAO,629,"AVISO DE ANULAÇÃO PREGÃO ELETRÔNICO Nº 02/2021 UASG: UASG: 926319 A Pregoeira da Fundação de Apoio à Pesquisa do Distrito Federal, comunica a anulação do certame licitatório oriundo do Edital de Licitação do Pregão Eletrônico nº 0002/2021 SUAG/DGA/FAPDF SUAG/DGA/FAPDF EXCLUSIVO EXCLUSIVO ME/EPP. Informamos que serão feitas as devidas alterações para a continuidade dos procedimentos. Processo 00193-00000432/2021-05. Os autos ficam com vistas franqueadas aos interessados, nesta Fundação de Apoio à Pesquisa do Distrito Federal, pelo e-mail: cpl@fap.df.gov.br. Brasília/DF, 24 de setembro de 2021 MARCILENE BONFIM LEITÃO SANTANA",00193-00000432/2021-05,Fundação de Apoio à Pesquisa do Distrito Federal,0002/2021,Pregão Eletrônico,MARCILENE BONFIM LEITÃO SANTANA,24 de setembro de 2021,anulação,O O O O O O O O O O O O O O O B-ORGAO_LICITANTE I-ORGAO_LICITANTE I-ORGAO_LICITANTE I-ORGAO_LICITANTE I-ORGAO_LICITANTE I-ORGAO_LICITANTE I-ORGAO_LICITANTE I-ORGAO_LICITANTE O O O B-IDENTIFICACAO_OCORRENCIA O O O O O O O O O B-MODALIDADE_LICITACAO I-MODALIDADE_LICITACAO O B-NUM_LICITACAO O O O O O O O O O O O O O O O O O O O O B-PROCESSO O O O O O O O O O O O B-ORGAO_LICITANTE I-ORGAO_LICITANTE I-ORGAO_LICITANTE I-ORGAO_LICITANTE I-ORGAO_LICITANTE I-ORGAO_LICITANTE I-ORGAO_LICITANTE I-ORGAO_LICITANTE O O O O O O O O O O B-DATA_ESCRITO I-DATA_ESCRITO I-DATA_ESCRITO I-DATA_ESCRITO I-DATA_ESCRITO B-NOME_RESPONSAVEL I-NOME_RESPONSAVEL I-NOME_RESPONSAVEL I-NOME_RESPONSAVEL
AVISO_ANUL_REV_LICITACAO,635,"AVISO DE ANULAÇÃO PREGÃO ELETRÔNICO Nº 57/2021 Processo: 00053-00082079/2021-51. TIPO: Menor preço. OBJETO: Contratação de empresa para execução de serviço contínuo comum de operação e manutenção preventiva e corretiva nos equipamentos de climatização instalados na Policlínica Médica (POMED) e Policlínica Odontológica (PODON) do CBMDF, conforme Edital e anexos. O DICOA informa que a licitação publicada no DODF nº 206 e DOU nº 207, ambos do dia 04/11/2021, foi ANULADA em virtude da identificação de vícios insanáveis no Edital. Inf: (61) 3901-3614. HÉLIO PEREIRA LIMA Diretor",00053-00082079/2021-51,CBMDF,57/2021,PREGÃO ELETRÔNICO,HÉLIO PEREIRA LIMA,04/11/2021,ANULADA,O O O B-MODALIDADE_LICITACAO I-MODALIDADE_LICITACAO O B-NUM_LICITACAO O O B-PROCESSO O O O O O O O O O O O O O O O O O O O O O O O O O O O O O O O O O O O O O O O O O O B-ORGAO_LICITANTE O O O O O O O O O O O O O O O O O O O O O O O O O B-DATA_ESCRITO O O B-IDENTIFICACAO_OCORRENCIA O O O O O O O O O O O O O O O O O B-NOME_RESPONSAVEL I-NOME_RESPONSAVEL I-NOME_RESPONSAVEL O
AVISO_ANUL_REV_LICITACAO,636,"AVISO DE REVOGAÇÃO DE LICITAÇÃO PREGÃO ELETRÔNICO Nº 07/2021 (AMPLA CONCORRÊNCIA) O GOVERNO DO DISTRITO FEDERAL POR MEIO DA SECRETARIA DE ESTADO DA AGRICULTURA, ABASTECIMENTO E DESENVOLVIMENTO RURAL DO DISTRITO FEDERAL SEAGRI/DF torna público que, por decisão da Autoridade Competente, nos termos do art. 50, caput, do Decreto nº 10.024/2019, e art. 49, caput, da Lei nº 8.666/93, REVOGA a licitação do tipo MENOR PREÇO UNITÁRIO, na modalidade de PREGÃO na forma ELETRÔNICA, com previsão de abertura do certame para 07/07/2021, às 09h30m que se encontrava suspensa, processo 00070-00004590/2020-41(SEI). OBJETO: Aquisição de veículos do tipo furgão leve de carga para atender demandas de associações de produtores rurais do Distrito Federal, de modo a garantir o transporte de produtos da agricultura familiar até os pontos de comercialização e de insumos até as propriedades dos associados, de acordo com o detalhamento descrito no item 03, do Termo de Referência, Anexo I do Edital, com valor Total estimado em R$ 164.000,00 (cento e sessenta e quatro mil reais). O aviso do evento de revogação poderá ser retirado a partir da publicação no Portal www.comprasgovernamentais.gov.br ou no portal da SEAGRI-DF, Licitação , a partir da sua divulgação. NATANAEL FÉLIX DOS SANTOS Pregoeiro",00070-00004590/2020-41,"SECRETARIA DE ESTADO DA AGRICULTURA, ABASTECIMENTO E DESENVOLVIMENTO RURAL DO DISTRITO FEDERAL SEAGRI/DF",07/2021,PREGÃO na forma ELETRÔNICA,NATANAEL FÉLIX DOS SANTOS,,REVOGA,O O O O O B-MODALIDADE_LICITACAO O O B-NUM_LICITACAO O O O O O O O O O O O O B-ORGAO_LICITANTE I-ORGAO_LICITANTE I-ORGAO_LICITANTE I-ORGAO_LICITANTE I-ORGAO_LICITANTE I-ORGAO_LICITANTE I-ORGAO_LICITANTE I-ORGAO_LICITANTE I-ORGAO_LICITANTE I-ORGAO_LICITANTE I-ORGAO_LICITANTE I-ORGAO_LICITANTE I-ORGAO_LICITANTE I-ORGAO_LICITANTE O O O O O O O O O O O O O O O O O O O O O O O O O O O O O O O O O O O O B-IDENTIFICACAO_OCORRENCIA O O O O O O O O O O O B-MODALIDADE_LICITACAO I-MODALIDADE_LICITACAO I-MODALIDADE_LICITACAO I-MODALIDADE_LICITACAO O O O O O O O O O O O O O O O O O O B-PROCESSO O O O O O O O O O O O O O O O O O O O O O O O O O O O O O O O O O O O O O O O O O O O O O O O O O O O O O O O O O O O O O O O O O O O O O O O O O O O O O O O O O O O O O O O O O O O O O O O O O O O O O O O O O O O O O O O O O O O O O O O O B-NOME_RESPONSAVEL I-NOME_RESPONSAVEL I-NOME_RESPONSAVEL I-NOME_RESPONSAVEL O
AVISO_ANUL_REV_LICITACAO,636,"AVISO DE REVOGAÇÃO PARCIAL DE LICITAÇÃO PREGÃO ELETRÔNICO Nº 07/2021 LOTE 4 A CARTÃO BRB S.A. torna público que o Lote 4, integrante da licitação referenciada no preâmbulo, fica revogado, tendo em vista questionamento impetrado judicialmente, via Mandado de Segurança (0732084-09.2021.8.07.0001 25ª Vara Cível de Brasília). Assim, no intuito maior de pugnar pelo melhor atendimento do interesse público, bem como permitir maior competividade no âmbito do procedimento licitatório, o Lote 4 resta excluído do certame. Novo edital, específico para a alienação do imóvel de propriedade da BRBCARD, será publicado a posteriori. Quanto aos demais lotes, sobre os quais não pairaram questionamentos ou impedimentos de natureza judicial, informa-se que seus objetos restam devidamente homologados. ALMIR FRANCISCO GOMES FILHO Presidente da Comissão",,BRB S.A.,07/2021,PREGÃO ELETRÔNICO,ALMIR FRANCISCO GOMES FILHO,,revogado,O O O O O O B-MODALIDADE_LICITACAO I-MODALIDADE_LICITACAO O B-NUM_LICITACAO O O O O B-ORGAO_LICITANTE O O O O O O O O O O O O O O O O B-IDENTIFICACAO_OCORRENCIA O O O O O O O O O O O O O O O O O O O O O O O O O O O O O O O O O O O O O O O O O O O O O O O O O O O O O O O O O O O O O O O O O O O O O O O O O O O O O O O O O O O O O O O O O O O O O O O O O O B-NOME_RESPONSAVEL I-NOME_RESPONSAVEL I-NOME_RESPONSAVEL I-NOME_RESPONSAVEL O O O
AVISO_ANUL_REV_LICITACAO,636,"AVISO DE REVOGAÇÃO CONCORRÊNCIA Nº 02/2021 A COMISSÃO PERMANENTE DE LICITAÇÃO, DA SUBSECRETARIA DE ADMINISTRAÇÃO GERAL, DA SECRETARIA DE ESTADO DE EDUCAÇÃO DO DISTRITO FEDERAL, comunica aos interessados que a Subsecretaria de Administração Geral da SEDF, por interesse da administração e, baseada na justificativa apresentadas pela Subsecretaria de Infraestrutura Escolar (SEI nº 66298959), constante no processo 00080-00008717/2020-63, a Revogação da Concorrência em epígrafe. Os autos ficam com vistas franqueadas aos interessados. JAIRO PEREIRA MARTINS Presidente",00080-00008717/2020-63,SECRETARIA DE ESTADO DE EDUCAÇÃO DO DISTRITO FEDERAL,02/2021,Concorrência,JAIRO PEREIRA MARTINS,,Revogação,O O O O O B-NUM_LICITACAO O O O O O O O O O O O O O B-ORGAO_LICITANTE I-ORGAO_LICITANTE I-ORGAO_LICITANTE I-ORGAO_LICITANTE I-ORGAO_LICITANTE I-ORGAO_LICITANTE I-ORGAO_LICITANTE I-ORGAO_LICITANTE O O O O O O O O O O O O O O O O O O O O O O O O O O O O O O O O O O O O O B-PROCESSO O O B-IDENTIFICACAO_OCORRENCIA O B-MODALIDADE_LICITACAO O O O O O O O O O O O O B-NOME_RESPONSAVEL I-NOME_RESPONSAVEL I-NOME_RESPONSAVEL O
AVISO_ANUL_REV_LICITACAO,625,"AVISO DE LICITAÇÃO REFERENTE AO EDITAL Nº 07/2016 IMÓVEIS IMÓVEIS A Diretoria Colegiada da Companhia Imobiliária de Brasília TERRACAP, TERRACAP, em sua Decisão nº 570/2021-DIRET, 3569ª sessão, realizada em 13/10/2021, decidiu, em razão do pedido de desistência formulado pela licitante JR VIRGHINI EMPREENDIMENTOS IMOBILIÁRIOS LTDA (Proposta de Compra nº 5001003), pela revogação da licitação do ITEM 143 do Edital nº 07/2016, aplicando-se a penalidade de retenção do valor caucionado, pelos motivos apresentados no Relatório nº 211/2021-ADCOM. Brasília/DF, 21 de outubro de 2021 BRUNO CESAR SANTANA DE MENESES Presidente da Comissão",,TERRACAP,07/2016,,BRUNO CESAR SANTANA DE MENESES,21 de outubro de 2021,revogação,O O O O O O O B-NUM_LICITACAO O O O O O O O O O O B-ORGAO_LICITANTE O B-ORGAO_LICITANTE O O O O O O O O O O O O O O O O O O O O O O O O O O O O O O O O O O O O O O O B-IDENTIFICACAO_OCORRENCIA O O O O O O O O B-NUM_LICITACAO O O O O O O O O O O O O O O O O O O O O B-DATA_ESCRITO I-DATA_ESCRITO I-DATA_ESCRITO I-DATA_ESCRITO I-DATA_ESCRITO B-NOME_RESPONSAVEL I-NOME_RESPONSAVEL I-NOME_RESPONSAVEL I-NOME_RESPONSAVEL I-NOME_RESPONSAVEL O O O
AVISO_ANUL_REV_LICITACAO,625,"AVISO DE REVOGAÇÃO DE PREGÃO ELETRÔNICO Nº 06/2021-SRP UASG 926210 A Secretaria de Estado de Trabalho do Distrito Federal, no uso das atribuições legais, em conformidade com a Lei nº 8.666/93, Decreto nº 39.610/2019 e Decreto nº 38.362/2017, bem como a Decisão nº 3443/2021 do TCDF fundamentando sua decisão; a Nota Jurídica nº 37/2021-SETRAB/GAB/AJL e acolhida pelo Secretário de Estado de Trabalho do Distrito Federal, resolve: REVOGAR em todos os seus termos, por interesse, conveniência e oportunidade, o Pregão Eletrônico nº 006/2021, processo 04012-00003480/2020-15, cujo o objeto é o Registro de Preços para contratação de empresa especializada na prestação de serviço de qualificação profissional e atendimento em unidades móveis, incluído recursos materiais, humanos, tecnológicos e toda gestão operacional para atender à Secretaria de Estado de Trabalho do Distrito Federal SETRAB. SETRAB. Brasília/DF, 06 de outubro de 2021 EUYNDHER SANTOS DE MORAIS Pregoeiro",04012-00003480/2020-15,Secretaria de Estado de Trabalho do Distrito Federal,006/2021,Pregão Eletrônico,EUYNDHER SANTOS DE MORAIS,06 de outubro de 2021,REVOGAR,O O O O O O O O O O O B-ORGAO_LICITANTE I-ORGAO_LICITANTE I-ORGAO_LICITANTE I-ORGAO_LICITANTE I-ORGAO_LICITANTE I-ORGAO_LICITANTE I-ORGAO_LICITANTE I-ORGAO_LICITANTE O O O O O O O O O O O O O O O O O O O O O O O O O O O O O O O O O O O O O O O O O O O O O O O O O O O O O O B-IDENTIFICACAO_OCORRENCIA O O O O O O O O O O O O O O B-MODALIDADE_LICITACAO I-MODALIDADE_LICITACAO O B-NUM_LICITACAO O O B-PROCESSO O O O O O O O O O O O O O O O O O O O O O O O O O O O O O O O O O O O O O O O O O B-ORGAO_LICITANTE I-ORGAO_LICITANTE I-ORGAO_LICITANTE I-ORGAO_LICITANTE I-ORGAO_LICITANTE I-ORGAO_LICITANTE I-ORGAO_LICITANTE I-ORGAO_LICITANTE O O O O O O B-DATA_ESCRITO I-DATA_ESCRITO I-DATA_ESCRITO I-DATA_ESCRITO I-DATA_ESCRITO B-NOME_RESPONSAVEL I-NOME_RESPONSAVEL I-NOME_RESPONSAVEL I-NOME_RESPONSAVEL O
AVISO_ANUL_REV_LICITACAO,631,"AVISO DE REVOGAÇÃO DE LICITAÇÃO (*) O Presidente da Comissão de Licitação para Compra de Bens, Serviços e Obras CPLIC/TERRACAP, no uso das atribuições que lhe confere a Portaria nº 231/2021 DIRAF, DIRAF, comunica a REVOGAÇÃO do seguinte certame. Processo: 0111-002346/2016 Modalidade/número: Concorrência nº 03/2017 REVOGAÇÃO REVOGAÇÃO Objeto: Contratação da implantação das redes de esgotamento sanitário das redes públicas e condominiais para atendimento ao Trecho 2 da 1ª Etapa do Setor Habitacional Taquari SHTQ; SHTQ; Brasília/DF, 26 de agosto de 2021 GLAUBER TEODORO FARIA Presidente da Comissão __________________ (*) Republicado por ter saído com incorreção no DODF nº 164, de 30 de agosto de 2021, página 55.",0111-002346/2016,TERRACAP,03/2017,Concorrência,GLAUBER TEODORO FARIA,30 de agosto de 2021,REVOGAÇÃO,O O B-IDENTIFICACAO_OCORRENCIA O O O O O O O O O O O O O O O O O O O O O O O O O O O O O O O O O O O O O O B-IDENTIFICACAO_OCORRENCIA O O O O O O B-PROCESSO O O B-MODALIDADE_LICITACAO O B-NUM_LICITACAO O B-IDENTIFICACAO_OCORRENCIA O O O O O O O O O O O O O O O O O O O O O O O O O O O O O O O O O O O O O O B-NOME_RESPONSAVEL I-NOME_RESPONSAVEL I-NOME_RESPONSAVEL O O O O O O O O O O O O O O O O O O O B-DATA_ESCRITO I-DATA_ESCRITO I-DATA_ESCRITO I-DATA_ESCRITO I-DATA_ESCRITO O O O O
AVISO_ANUL_REV_LICITACAO,672,"AVISO DE REVOGAÇÃO DE LICITAÇÃO O Presidente da Comissão de Licitação para Compra de Bens, Serviços e Obras, no uso das atribuições que lhe confere a Portaria nº 231/2021 DIRAF, DIRAF, comunica a REVOGAÇÃO do seguinte certame. Processo: 00111-00009348/2019-79 Modalidade/número: Pregão Eletrônico nº 09/2020 REVOGAÇÃO REVOGAÇÃO Tipo: Menor Preço por lote Objeto: Contratação de auditoria médica em serviços de assistência à saúde, avaliação atuarial e consultoria especializada para acompanhamento de contrato de plano de saúde Data/hora de abertura: 30/12/2020, às 10:00 horas",00111-00009348/2019-79,,09/2020,Pregão Eletrônico,,30/12/2020,REVOGAÇÃO,O O B-IDENTIFICACAO_OCORRENCIA O O O O O O O O O O O O O O O O O O O O O O O O O O O O O O O O O O B-IDENTIFICACAO_OCORRENCIA O O O O O O B-PROCESSO O O B-MODALIDADE_LICITACAO I-MODALIDADE_LICITACAO O B-NUM_LICITACAO O B-IDENTIFICACAO_OCORRENCIA O O O O O O O O O O O O O O O O O O O O O O O O O O O O O O O O O O O O B-DATA_ESCRITO O O O O
AVISO_ANUL_REV_LICITACAO,669,"AVISO DE REVOGAÇÃO PREGÃO ELETRÔNICO SRP Nº 02/2021 UASG 926873 O Consórcio Interestadual de Desenvolvimento do Brasil Central, por intermédio da Secretaria Executiva, nos termos do art. 49 da Lei Federal nº 8.666/93, com suas alterações legais, torna público o aviso de Revogação do Pregão Eletrônico SRP n° 02/2021, da Licitação no Processo Administrativo Licitatório nº 20201607000083, cujo o objeto é o registro de preços para futura e eventual contratação de empresa especializada no fornecimento de Equipamento de Proteção Individual EPIs necessários para o atendimento pelos profissionais de saúde aos pacientes diagnosticados e em tratamento decorrente da infecção pelo novo coronavírus (SARS-CoV-2), em apoio aos Entes integrantes do Consórcio Interestadual de Desenvolvimento do Brasil Central BrC BrC (Distrito Federal, Mato Grosso, Mato Grosso do Sul e Tocantins). MARCUS VINICIUS BRITTO Secretário Executivo",20201607000083,Consórcio Interestadual de Desenvolvimento do Brasil Central BrC BrC,02/2021,Pregão Eletrônico,MARCUS VINICIUS BRITTO,,Revogação,O O O O O O O B-NUM_LICITACAO O O O B-ORGAO_LICITANTE I-ORGAO_LICITANTE I-ORGAO_LICITANTE I-ORGAO_LICITANTE I-ORGAO_LICITANTE I-ORGAO_LICITANTE I-ORGAO_LICITANTE O O O O O O O O O O O O O O O O O O O O O O O O O O O O O B-IDENTIFICACAO_OCORRENCIA O B-MODALIDADE_LICITACAO I-MODALIDADE_LICITACAO O O B-NUM_LICITACAO O O O O O O O O B-PROCESSO O O O O O O O O O O O O O O O O O O O O O O O O O O O O O O O O O O O O O O O O O O O O O O O O O O O O O O O B-ORGAO_LICITANTE I-ORGAO_LICITANTE I-ORGAO_LICITANTE I-ORGAO_LICITANTE I-ORGAO_LICITANTE I-ORGAO_LICITANTE I-ORGAO_LICITANTE I-ORGAO_LICITANTE I-ORGAO_LICITANTE O O O O O O O O O O O O O O O B-NOME_RESPONSAVEL I-NOME_RESPONSAVEL I-NOME_RESPONSAVEL O O
AVISO_ANUL_REV_LICITACAO,667,"AVISO DE ANULAÇÃO PREGÃO ELETRÔNICO Nº 12/2021 METRÔ-DF UASG 925046 O METRÔ-DF, por meio do Pregoeiro, comunica a anulação do mencionado pregão eletrônico, cujo objeto trata do Registro de Preços para eventual contratação de empresa para fornecimento e instalação de cerca (grade) de vedação e concertina ao longo da via permanente, em locais de vulnerabilidade, da Companhia do Metropolitano do Distrito Federal METRÔ-DF METRÔ-DF e Companhia Urbanizadora da Nova Capital do Brasil NOVACAP, visto ter sido constatada a inviabilidade do julgamento das propostas pelo Metrô-DF, visto ter ocorrido equívoco no cadastramento da licitação no sistema Comprasnet em relação à disposição do item 11.5.1 do Edital. É garantido aos interessados a contestação do presente ato, no prazo de até cinco dias úteis a contar desta publicação. Transcorrido o prazo concedido e não havendo manifestação em contrário, o ato de anulação restará efetivado. Fica assegurado vista aos autos do processo 0009700011722/2020-29, mediante solicitação pelo e-mail: licitacao@metro.df.gov.br. DIEGO MONDINI DE SOUZA Pregoeiro",0009700011722/2020-29,Companhia do Metropolitano do Distrito Federal METRÔ-DF METRÔ-DF,12/2021,PREGÃO ELETRÔNICO,DIEGO MONDINI DE SOUZA,,anulação,O O O B-MODALIDADE_LICITACAO I-MODALIDADE_LICITACAO O B-NUM_LICITACAO O O O O O O O O O O O O O B-IDENTIFICACAO_OCORRENCIA O O O O O O O O O O O O O O O O O O O O O O O O O O O O O O O O O O O O O O O O O O B-ORGAO_LICITANTE I-ORGAO_LICITANTE I-ORGAO_LICITANTE I-ORGAO_LICITANTE I-ORGAO_LICITANTE I-ORGAO_LICITANTE I-ORGAO_LICITANTE I-ORGAO_LICITANTE O B-ORGAO_LICITANTE O O O O O O O O O O O O O O O O O O O O O O O O O O O O O O O O O O O O O O O O O O O O O O O O O O O O O O O O O O O O O O O O O O O O O O O O O O O O O O B-IDENTIFICACAO_OCORRENCIA O O O O O O O O O O B-PROCESSO O O O O O O O O O O B-NOME_RESPONSAVEL I-NOME_RESPONSAVEL I-NOME_RESPONSAVEL I-NOME_RESPONSAVEL O
AVISO_ANUL_REV_LICITACAO,667,"AVISO DE REVOGAÇÃO DE LICITAÇÃO A Caesb torna público que a Licitação Fechada LF LF 003/2021-Caesb, processo 092.003265/2021, cujo objeto é a implantação do reservatório apoiado RAP.ALG.001, constituído de uma câmara de 6.000m³, fabricado em chapa de aço revestidas em epóxi, aparafusado, a ser implantado em Águas Lindas de Goiás GO GO foi REVOGADA por conveniência administrativa, conforme despacho GABDE (0357317). Mais informações, acesse o site da Caesb (https://www.caesb.df.gov.br/licitacoes2/modalidadeslicitacao.html) e ComprasNet (http://comprasnet.gov.br/Livre/RDC/rdcEletronico.asp) SILVIO SANTOS GONÇALVES SOARES Pregoeiro",092.003265/2021,Caesb,003/2021-Caesb,Licitação Fechada,SILVIO SANTOS GONÇALVES SOARES,,REVOGADA,O O O O O O B-ORGAO_LICITANTE O O O O B-MODALIDADE_LICITACAO I-MODALIDADE_LICITACAO O O B-NUM_LICITACAO O O B-PROCESSO O O O O O O O O O O O O O O O O O O O O O O O O O O O O O O O O O O O O O O O O B-IDENTIFICACAO_OCORRENCIA O O O O O O O O O O O O O O O O O O B-ORGAO_LICITANTE O O O O O O O O O O O O B-NOME_RESPONSAVEL I-NOME_RESPONSAVEL I-NOME_RESPONSAVEL I-NOME_RESPONSAVEL O
